{
  "schemaVersion": 1,
  "release": "unreleased",
  "generatedAt": "2026-08-05T00:00:00Z",
  "maxAgeDays": 30,
  "entries": [
    {
      "target": "aarch64-apple-darwin",
      "tier": 1,
      "environment": "not-run",
      "checks": {
        "build": {
          "status": "not-run",
          "reason": "No authorized release evidence supplied"
        },
        "native": {
          "status": "not-run",
          "reason": "No authorized release evidence supplied"
        },
        "escape": {
          "status": "not-run",
          "reason": "No authorized release evidence supplied"
        },
        "signing": {
          "status": "not-run",
          "reason": "No authorized release evidence supplied"
        },
        "notarize": {
          "status": "not-run",
          "reason": "No authorized release evidence supplied"
        }
      },
      "reason": "Pending authorized native or real-hardware execution"
    },
    {
      "target": "aarch64-apple-darwin",
      "tier": 2,
      "environment": "not-run",
      "checks": {
        "build": {
          "status": "not-run",
          "reason": "No authorized release evidence supplied"
        },
        "native": {
          "status": "not-run",
          "reason": "No authorized release evidence supplied"
        },
        "escape": {
          "status": "not-run",
          "reason": "No authorized release evidence supplied"
        },
        "signing": {
          "status": "not-run",
          "reason": "No authorized release evidence supplied"
        },
        "notarize": {
          "status": "not-run",
          "reason": "No authorized release evidence supplied"
        }
      },
      "reason": "Pending authorized native or real-hardware execution"
    },
    {
      "target": "aarch64-apple-darwin",
      "tier": 3,
      "environment": "not-run",
      "checks": {
        "build": {
          "status": "not-run",
          "reason": "No authorized release evidence supplied"
        },
        "native": {
          "status": "not-run",
          "reason": "No authorized release evidence supplied"
        },
        "escape": {
          "status": "not-run",
          "reason": "No authorized release evidence supplied"
        },
        "signing": {
          "status": "not-run",
          "reason": "No authorized release evidence supplied"
        },
        "notarize": {
          "status": "not-run",
          "reason": "No authorized release evidence supplied"
        }
      },
      "reason": "Pending authorized native or real-hardware execution"
    },
    {
      "target": "x86_64-apple-darwin",
      "tier": 1,
      "environment": "not-run",
      "checks": {
        "build": {
          "status": "not-run",
          "reason": "No authorized release evidence supplied"
        },
        "native": {
          "status": "not-run",
          "reason": "No authorized release evidence supplied"
        },
        "escape": {
          "status": "not-run",
          "reason": "No authorized release evidence supplied"
        },
        "signing": {
          "status": "not-run",
          "reason": "No authorized release evidence supplied"
        },
        "notarize": {
          "status": "not-run",
          "reason": "No authorized release evidence supplied"
        }
      },
      "reason": "Pending authorized native or real-hardware execution"
    },
    {
      "target": "x86_64-apple-darwin",
      "tier": 2,
      "environment": "not-run",
      "checks": {
        "build": {
          "status": "not-run",
          "reason": "No authorized release evidence supplied"
        },
        "native": {
          "status": "not-run",
          "reason": "No authorized release evidence supplied"
        },
        "escape": {
          "status": "not-run",
          "reason": "No authorized release evidence supplied"
        },
        "signing": {
          "status": "not-run",
          "reason": "No authorized release evidence supplied"
        },
        "notarize": {
          "status": "not-run",
          "reason": "No authorized release evidence supplied"
        }
      },
      "reason": "Pending authorized native or real-hardware execution"
    },
    {
      "target": "x86_64-apple-darwin",
      "tier": 3,
      "environment": "not-run",
      "checks": {
        "build": {
          "status": "not-run",
          "reason": "No authorized release evidence supplied"
        },
        "native": {
          "status": "not-run",
          "reason": "No authorized release evidence supplied"
        },
        "escape": {
          "status": "not-run",
          "reason": "No authorized release evidence supplied"
        },
        "signing": {
          "status": "not-run",
          "reason": "No authorized release evidence supplied"
        },
        "notarize": {
          "status": "not-run",
          "reason": "No authorized release evidence supplied"
        }
      },
      "reason": "Pending authorized native or real-hardware execution"
    },
    {
      "target": "x86_64-unknown-linux-gnu",
      "tier": 1,
      "environment": "not-run",
      "checks": {
        "build": {
          "status": "not-run",
          "reason": "No authorized release evidence supplied"
        },
        "native": {
          "status": "not-run",
          "reason": "No authorized release evidence supplied"
        },
        "escape": {
          "status": "not-run",
          "reason": "No authorized release evidence supplied"
        },
        "signing": {
          "status": "not-run",
          "reason": "No authorized release evidence supplied"
        },
        "notarize": {
          "status": "not-run",
          "reason": "No authorized release evidence supplied"
        }
      },
      "reason": "Pending authorized native or real-hardware execution"
    },
    {
      "target": "x86_64-unknown-linux-gnu",
      "tier": 2,
      "environment": "not-run",
      "checks": {
        "build": {
          "status": "not-run",
          "reason": "No authorized release evidence supplied"
        },
        "native": {
          "status": "not-run",
          "reason": "No authorized release evidence supplied"
        },
        "escape": {
          "status": "not-run",
          "reason": "No authorized release evidence supplied"
        },
        "signing": {
          "status": "not-run",
          "reason": "No authorized release evidence supplied"
        },
        "notarize": {
          "status": "not-run",
          "reason": "No authorized release evidence supplied"
        }
      },
      "reason": "Pending authorized native or real-hardware execution"
    },
    {
      "target": "x86_64-unknown-linux-gnu",
      "tier": 3,
      "environment": "not-run",
      "checks": {
        "build": {
          "status": "not-run",
          "reason": "No authorized release evidence supplied"
        },
        "native": {
          "status": "not-run",
          "reason": "No authorized release evidence supplied"
        },
        "escape": {
          "status": "not-run",
          "reason": "No authorized release evidence supplied"
        },
        "signing": {
          "status": "not-run",
          "reason": "No authorized release evidence supplied"
        },
        "notarize": {
          "status": "not-run",
          "reason": "No authorized release evidence supplied"
        }
      },
      "reason": "Pending authorized native or real-hardware execution"
    },
    {
      "target": "aarch64-unknown-linux-gnu",
      "tier": 1,
      "environment": "not-run",
      "checks": {
        "build": {
          "status": "not-run",
          "reason": "No authorized release evidence supplied"
        },
        "native": {
          "status": "not-run",
          "reason": "No authorized release evidence supplied"
        },
        "escape": {
          "status": "not-run",
          "reason": "No authorized release evidence supplied"
        },
        "signing": {
          "status": "not-run",
          "reason": "No authorized release evidence supplied"
        },
        "notarize": {
          "status": "not-run",
          "reason": "No authorized release evidence supplied"
        }
      },
      "reason": "Pending authorized native or real-hardware execution"
    },
    {
      "target": "aarch64-unknown-linux-gnu",
      "tier": 2,
      "environment": "not-run",
      "checks": {
        "build": {
          "status": "not-run",
          "reason": "No authorized release evidence supplied"
        },
        "native": {
          "status": "not-run",
          "reason": "No authorized release evidence supplied"
        },
        "escape": {
          "status": "not-run",
          "reason": "No authorized release evidence supplied"
        },
        "signing": {
          "status": "not-run",
          "reason": "No authorized release evidence supplied"
        },
        "notarize": {
          "status": "not-run",
          "reason": "No authorized release evidence supplied"
        }
      },
      "reason": "Pending authorized native or real-hardware execution"
    },
    {
      "target": "aarch64-unknown-linux-gnu",
      "tier": 3,
      "environment": "not-run",
      "checks": {
        "build": {
          "status": "not-run",
          "reason": "No authorized release evidence supplied"
        },
        "native": {
          "status": "not-run",
          "reason": "No authorized release evidence supplied"
        },
        "escape": {
          "status": "not-run",
          "reason": "No authorized release evidence supplied"
        },
        "signing": {
          "status": "not-run",
          "reason": "No authorized release evidence supplied"
        },
        "notarize": {
          "status": "not-run",
          "reason": "No authorized release evidence supplied"
        }
      },
      "reason": "Pending authorized native or real-hardware execution"